{
  "schemaVersion": "1.1.0",
  "formatProfileId": "TEST_GENERIC_SLOT",
  "templateId": "TEST_GENERIC_SLOT_V1",
  "copy": {},
  "assets": [{ "assetId": "stock-01", "mimeType": "image/png", "assetRef": { "type": "FIXTURE_ASSET_ID", "value": "stock-01.png" } }],
  "imagePlacementPlans": [{ "schemaVersion": "1.1.0", "imageSlotId": "TEST_IMAGE_SLOT", "assetId": "stock-01", "policy": "SEMANTIC_CROP_COVER", "source": "AGENT", "fitMode": "COVER", "cropRect": { "x": 0.1, "y": 0.1, "width": 0.8, "height": 0.8 }, "anchor": "CENTER", "subjectProtection": "NONE", "confidence": 0.88, "rationale": "agent plan" }],
  "output": { "mimeType": "image/png" }
}
