{
  "schemaVersion": "1.1.0",
  "formatProfileId": "KAKAO_BIZBOARD_THUMBNAIL_BOX_RIGHT",
  "templateId": "KAKAO_MOMENT_BIZBOARD_THUMBNAIL_BOX_RIGHT",
  "copy": { "advertiser": "자코모", "headline": "자코모 프리미엄 소파", "subcopy": "거실을 바꾸는 선택", "cta": "NONE" },
  "assets": [{ "assetId": "thumbnail-basic", "mimeType": "image/png", "assetRef": { "type": "FIXTURE_ASSET_ID", "value": "thumbnail-box-right__asset__basic__pass.png" } }],
  "imagePlacementPlans": [{ "schemaVersion": "1.1.0", "imageSlotId": "IMAGE_PRIMARY", "assetId": "thumbnail-basic", "policy": "SEMANTIC_CROP_COVER", "source": "AGENT", "fitMode": "COVER", "cropCandidateId": "candidate-main", "anchor": "CENTER", "subjectProtection": "NONE" }],
  "cropCandidates": [{ "schemaVersion": "1.1.0", "candidateId": "candidate-main", "assetId": "thumbnail-basic", "imageSlotId": "IMAGE_PRIMARY", "cropRect": { "x": 0, "y": 0, "width": 1, "height": 1 }, "preservedSubjectIds": [], "clippedSubjectIds": [], "fillRatio": 1, "subjectCoverageRatio": 1, "warnings": [] }],
  "output": { "mimeType": "image/png" }
}
